### ISSUE TITLE
weaver process using excessive amount of cpu and network

### ISSUE THREAD

**Issue by bmurphy1976** [zettio/weave#417]
The weaver process on some of our nodes is using an excessive amount of CPU for long periods at a time.  Here's 30 second snapshot of CPU utilization (the server has 2 cores so one core is pegged during this period).  This actually happens for a couple minutes at a time.

Also, please note at the same time we are seeing high CPU usage we are also seeing very high network traffic.  None of our services running on these boxes should use anything even close to the amount of network traffic shown.  Typically usage is 100-300KB/sec, but when weaver is using CPU we see network traffic upwards of 100MB/sec.

```
----system---- ----total-cpu-usage---- -dsk/total- -net/total- ---paging-- ---system-- ----most-expensive---- -most-expensive-
     time     |usr sys idl wai hiq siq| read  writ| recv  send|  in   out | int   csw |     i/o process      |  cpu process
24-02 20:03:10| 41  39  15   0   0   6|   0     0 | 104M  107M|   0     0 |  30k   50k|weaver        0    52M|weaver        56
24-02 20:03:11| 35  43  13   0   0   9|   0   144k| 108M  110M|   0     0 |  31k   52k|weaver        0    54M|weaver        55
24-02 20:03:12| 44  38  13   0   0   5|   0     0 | 106M  109M|   0     0 |  26k   48k|weaver       16k   54M|weaver        53
24-02 20:03:13| 40  39  13   0   0   8|   0    48k| 104M  107M|   0     0 |  28k   51k|weaver     1409B   52M|weaver        53
24-02 20:03:14| 40  40  13   0   0   8|   0     0 | 107M  109M|   0     0 |  29k   50k|weaver        0    53M|weaver        55
24-02 20:03:15| 46  37  11   0   0   6|   0     0 | 107M  109M|   0     0 |  25k   46k|weaver        0    53M|weaver        54
24-02 20:03:16| 36  43  12   0   0   8|   0    40k| 108M  110M|   0     0 |  30k   52k|weaver        0    54M|weaver        56
24-02 20:03:17| 44  38  12   0   0   5|   0   152k| 107M  109M|   0     0 |  26k   47k|weaver       12k   54M|weaver        52
24-02 20:03:18| 45  36  14   0   0   5|   0    88k| 106M  108M|   0     0 |  26k   48k|weaver        0    53M|weaver        53
24-02 20:03:19| 42  38  12   0   0   8|   0     0 | 106M  108M|   0     0 |  30k   51k|weaver     1409B   52M|weaver        54
24-02 20:03:20| 42  37  13   0   0   7|   0     0 | 108M  111M|   0     0 |  29k   50k|weaver        0    54M|weaver        54
24-02 20:03:21| 35  44  13   0   0   8|   0     0 | 108M  110M|   0     0 |  29k   51k|weaver        0    54M|weaver        57
24-02 20:03:22| 39  41  12   0   0   8|   0    24k| 106M  109M|   0     0 |  28k   51k|weaver        0    53M|weaver        54
24-02 20:03:23| 49  36   9   0   0   6|   0    64k|  94M   96M|   0     0 |  24k   43k|weaver        0    47M|weaver        48
24-02 20:03:24| 68  29   0   0   0   3|   0     0 |  54M   55M|   0     0 |5395    35k|weaver       18k   27M|scout         48
24-02 20:03:25| 69  25   1   0   0   5|   0     0 |  60M   61M|   0     0 |8129    37k|weaver        0    30M|scout         42
24-02 20:03:26| 41  41  12   0   0   6|   0     0 | 107M  109M|   0     0 |  32k   51k|weaver        0    54M|weaver        57
24-02 20:03:27| 41  41  11   0   0   6|   0   140k| 107M  108M|   0     0 |  24k   48k|weaver        0    53M|weaver        52
24-02 20:03:28| 46  35  11   0   0   8|   0   104k| 108M  109M|   0     0 |  26k   47k|weaver     8352B   53M|weaver        56
24-02 20:03:29| 43  41  10   0   0   6|   0     0 |  97M   98M|   0     0 |  25k   46k|weaver        0    48M|weaver        50
24-02 20:03:30| 44  41  10   0   0   5|   0     0 | 101M  103M|   0     0 |  27k   46k|weaver        0    51M|weaver        52
24-02 20:03:31| 38  44  13   0   0   5|   0     0 | 108M  111M|   0     0 |  30k   51k|weaver        0    53M|weaver        54
24-02 20:03:32| 43  38  13   0   0   5|   0     0 | 108M  110M|   0     0 |  28k   52k|weaver     1409B   55M|weaver        55
24-02 20:03:33| 41  44  11   0   0   4|   0   108k| 104M  106M|   0     0 |  29k   52k|weaver        0    52M|weaver        54
24-02 20:03:34| 43  38  12   0   0   7|   0     0 | 108M  110M|   0     0 |  27k   50k|weaver       77B   53M|weaver        54
24-02 20:03:35| 39  42  12   0   0   7|   0     0 | 107M  110M|   0     0 |  28k   50k|weaver        0    54M|weaver        56
24-02 20:03:36| 38  45  12   0   0   6|   0    72k| 110M  112M|   0     0 |  28k   51k|weaver     1407B   54M|weaver        55
24-02 20:03:37| 36  42  13   0   0   9|   0     0 | 105M  107M|   0     0 |  31k   51k|weaver        0    52M|weaver        54
24-02 20:03:38| 39  42  12   0   0   7|   0    96k| 105M  107M|   0     0 |  26k   51k|weaver        0    52M|weaver        52
24-02 20:03:39| 40  38  13   0   0   9|   0     0 | 105M  108M|   0     0 |  29k   50k|weaver        0    52M|weaver        53
24-02 20:03:40| 46  36  12   0   0   7|   0     0 | 112M  114M|   0     0 |  26k   45k|weaver       14k   55M|weaver        56
24-02 20:03:41| 42  38  12   0   0   8|   0     0 | 107M  110M|   0     0 |  28k   52k|weaver        0    53M|weaver        55
24-02 20:03:42| 39  40  14   0   0   7|   0   140k| 109M  112M|   0     0 |  32k   51k|weaver        0    55M|weaver        56
```

Here are weave logs from the same timeframe:

```
weave 2015/02/24 20:03:01.072070 ->[7a:02:0f:ac:19:f4]: Cannot forward frame yet - awaiting contact
weave 2015/02/24 20:03:01.072428 ->[7a:02:0f:ac:19:f4]: Cannot forward frame yet - awaiting contact
weave 2015/02/24 20:03:01.856588 ->[7a:8b:d8:d8:4a:88]: connection shutting down due to error: read tcp4 192.168.2.254:55309: i/o timeout
weave 2015/02/24 20:03:01.856820 ->[7a:8b:d8:d8:4a:88]: connection deleted
weave 2015/02/24 20:03:01.857370 ->[192.168.1.254:6783] attempting connection
weave 2015/02/24 20:03:01.857479 ->[192.168.4.254:48716] attempting connection
weave 2015/02/24 20:03:01.857556 ->[192.168.4.254:6783] attempting connection
weave 2015/02/24 20:03:01.857625 ->[192.168.1.254:48383] attempting connection
weave 2015/02/24 20:03:01.859337 ->[192.168.1.254:48383] error during connection attempt: dial tcp4 192.168.1.254:48383: connection refused
weave 2015/02/24 20:03:01.864622 ->[192.168.2.254:51390] connection accepted
weave 2015/02/24 20:03:01.865520 ->[192.168.2.254:51390] completed handshake with 7a:8b:d8:d8:4a:88
weave 2015/02/24 20:03:01.866127 ->[7a:8b:d8:d8:4a:88]: connection added
weave 2015/02/24 20:03:01.869212 ->[192.168.1.254:6783] connection shutting down due to error during handshake: Already have connection to 7a:21:54:68:1a:41 at 10.99.185.203:6783
weave 2015/02/24 20:03:01.965484 ->[192.168.4.254:48716] error during connection attempt: dial tcp4 192.168.4.254:48716: connection refused
weave 2015/02/24 20:03:02.069558 ->[7a:02:0f:ac:19:f4]: Cannot forward frame yet - awaiting contact
weave 2015/02/24 20:03:02.069586 ->[7a:8b:d8:d8:4a:88]: Cannot forward frame yet - awaiting contact
weave 2015/02/24 20:03:02.069611 ->[7a:02:0f:ac:19:f4]: Cannot forward frame yet - awaiting contact
weave 2015/02/24 20:03:02.069622 ->[7a:8b:d8:d8:4a:88]: Cannot forward frame yet - awaiting contact
weave 2015/02/24 20:03:02.091428 ->[192.168.4.254:6783] connection shutting down due to error during handshake: Already have connection to 7a:87:ef:4c:d7:5e at 192.168.2.254:43466
weave 2015/02/24 20:03:02.137979 ->[7a:8b:d8:d8:4a:88]: connection shutting down due to error: Failed to decode packet: decryption failed; Unable to decrypt UDP packet
weave 2015/02/24 20:03:02.138161 ->[7a:8b:d8:d8:4a:88]: connection deleted
weave 2015/02/24 20:03:02.138612 ->[192.168.1.254:6783] attempting connection
weave 2015/02/24 20:03:02.138755 ->[192.168.4.254:48716] attempting connection
weave 2015/02/24 20:03:02.138857 ->[192.168.1.254:48383] attempting connection
weave 2015/02/24 20:03:02.138981 ->[192.168.4.254:6783] attempting connection
weave 2015/02/24 20:03:02.139964 ->[192.168.1.254:48383] error during connection attempt: dial tcp4 192.168.1.254:48383: connection refused
weave 2015/02/24 20:03:02.143524 ->[192.168.2.254:51393] connection accepted
weave 2015/02/24 20:03:02.143686 ->[192.168.1.254:6783] connection shutting down due to error during handshake: Already have connection to 7a:21:54:68:1a:41 at 10.99.185.203:6783
weave 2015/02/24 20:03:02.144359 ->[192.168.2.254:51393] completed handshake with 7a:8b:d8:d8:4a:88
weave 2015/02/24 20:03:02.144731 ->[7a:8b:d8:d8:4a:88]: connection added
weave 2015/02/24 20:03:02.145254 ->[192.168.2.254:56597] connection accepted
weave 2015/02/24 20:03:02.145988 ->[192.168.2.254:56597] completed handshake with 7a:8b:d8:d8:4a:88
weave 2015/02/24 20:03:02.146032 ->[7a:8b:d8:d8:4a:88]: connection shutting down due to error: Multiple connections to 7a:8b:d8:d8:4a:88 added to 7a:8c:a1:e4:43:13
weave 2015/02/24 20:03:02.159161 ->[7a:8b:d8:d8:4a:88]: connection shutting down due to error: Failed to decode packet: decryption failed; Unable to decrypt UDP packet
weave 2015/02/24 20:03:02.159281 ->[7a:8b:d8:d8:4a:88]: connection deleted
weave 2015/02/24 20:03:02.159438 ->[192.168.1.254:48383] attempting connection
weave 2015/02/24 20:03:02.159443 ->[192.168.1.254:6783] attempting connection
weave 2015/02/24 20:03:02.161210 ->[192.168.1.254:48383] error during connection attempt: dial tcp4 192.168.1.254:48383: connection refused
weave 2015/02/24 20:03:02.164069 ->[192.168.1.254:6783] connection shutting down due to error during handshake: Already have connection to 7a:21:54:68:1a:41 at 10.99.185.203:6783
weave 2015/02/24 20:03:02.217245 ->[192.168.2.254:51396] connection accepted
weave 2015/02/24 20:03:02.257623 ->[192.168.2.254:51396] completed handshake with 7a:8b:d8:d8:4a:88
weave 2015/02/24 20:03:02.258145 ->[7a:8b:d8:d8:4a:88]: connection added
weave 2015/02/24 20:03:03.073536 ->[7a:8b:d8:d8:4a:88]: Cannot forward frame yet - awaiting contact
weave 2015/02/24 20:03:03.073567 ->[7a:02:0f:ac:19:f4]: Cannot forward frame yet - awaiting contact
weave 2015/02/24 20:03:04.398885 Discovered remote MAC 02:42:c0:a8:04:2f at 7a:87:ef:4c:d7:5e
weave 2015/02/24 20:03:05.549208 Discovered remote MAC 02:42:c0:a8:04:30 at 7a:87:ef:4c:d7:5e
weave 2015/02/24 20:03:05.577444 ->[7a:8b:d8:d8:4a:88]: Cannot forward frame yet - awaiting contact
weave 2015/02/24 20:03:05.577473 ->[7a:02:0f:ac:19:f4]: Cannot forward frame yet - awaiting contact
weave 2015/02/24 20:03:06.143453 ->[192.168.2.254:56683] connection accepted
weave 2015/02/24 20:03:06.144649 ->[192.168.2.254:56683] completed handshake with 7a:8b:d8:d8:4a:88
weave 2015/02/24 20:03:06.144691 ->[7a:8b:d8:d8:4a:88]: connection shutting down due to error: Multiple connections to 7a:8b:d8:d8:4a:88 added to 7a:8c:a1:e4:43:13
weave 2015/02/24 20:03:06.148679 ->[7a:8b:d8:d8:4a:88]: connection shutting down due to error: Failed to decode packet: decryption failed; Unable to decrypt UDP packet
weave 2015/02/24 20:03:06.148823 ->[7a:8b:d8:d8:4a:88]: connection deleted
weave 2015/02/24 20:03:06.150078 ->[192.168.1.254:48383] attempting connection
weave 2015/02/24 20:03:06.150084 ->[192.168.1.254:6783] attempting connection
weave 2015/02/24 20:03:06.151373 ->[192.168.1.254:48383] error during connection attempt: dial tcp4 192.168.1.254:48383: connection refused
weave 2015/02/24 20:03:06.153468 ->[192.168.1.254:6783] connection shutting down due to error during handshake: Already have connection to 7a:21:54:68:1a:41 at 10.99.185.203:6783
weave 2015/02/24 20:03:06.153968 ->[192.168.2.254:51407] connection accepted
weave 2015/02/24 20:03:06.154682 ->[192.168.2.254:51407] completed handshake with 7a:8b:d8:d8:4a:88
weave 2015/02/24 20:03:06.154992 ->[7a:8b:d8:d8:4a:88]: connection added
weave 2015/02/24 20:03:06.573530 ->[7a:02:0f:ac:19:f4]: Cannot forward frame yet - awaiting contact
weave 2015/02/24 20:03:06.573570 ->[7a:8b:d8:d8:4a:88]: Cannot forward frame yet - awaiting contact
weave 2015/02/24 20:03:07.222338 ->[192.168.4.254:6783] connection shutting down due to error during handshake: Already have connection to 7a:87:ef:4c:d7:5e at 192.168.2.254:43466
weave 2015/02/24 20:03:07.573554 ->[7a:02:0f:ac:19:f4]: Cannot forward frame yet - awaiting contact
weave 2015/02/24 20:03:07.573582 ->[7a:8b:d8:d8:4a:88]: Cannot forward frame yet - awaiting contact
weave 2015/02/24 20:03:09.089334 ->[7a:02:0f:ac:19:f4]: Cannot forward frame yet - awaiting contact
weave 2015/02/24 20:03:09.089477 ->[7a:8b:d8:d8:4a:88]: Cannot forward frame yet - awaiting contact
weave 2015/02/24 20:03:09.096299 ->[192.168.2.254:36514] connection accepted
weave 2015/02/24 20:03:09.096855 ->[192.168.2.254:36514] connection shutting down due to error during handshake: Already have connection to 7a:b5:2d:25:d1:cf at 192.168.2.254:55467
weave 2015/02/24 20:03:09.113064 ->[7a:b5:2d:25:d1:cf]: connection shutting down due to error: read tcp4 192.168.2.254:55467: i/o timeout
weave 2015/02/24 20:03:09.113224 ->[7a:b5:2d:25:d1:cf]: connection deleted
weave 2015/02/24 20:03:09.113642 ->[192.168.1.254:51106] attempting connection
weave 2015/02/24 20:03:09.113758 ->[192.168.1.254:6783] attempting connection
weave 2015/02/24 20:03:09.113994 ->[192.168.4.254:6783] attempting connection
weave 2015/02/24 20:03:09.113894 ->[192.168.4.254:39140] attempting connection
weave 2015/02/24 20:03:09.115351 ->[192.168.1.254:51106] error during connection attempt: dial tcp4 192.168.1.254:51106: connection refused
weave 2015/02/24 20:03:09.117331 ->[192.168.1.254:6783] connection shutting down due to error during handshake: Already have connection to 7a:21:54:68:1a:41 at 10.99.185.203:6783
weave 2015/02/24 20:03:09.124112 ->[192.168.4.254:39140] error during connection attempt: dial tcp4 192.168.4.254:39140: connection refused
weave 2015/02/24 20:03:09.135035 ->[192.168.4.254:6783] connection shutting down due to error during handshake: Already have connection to 7a:87:ef:4c:d7:5e at 192.168.2.254:43466
weave 2015/02/24 20:03:09.161028 ->[192.168.4.254:48716] error during connection attempt: dial tcp4 192.168.4.254:48716: connection refused
weave 2015/02/24 20:03:09.265145 ->[192.168.2.254:56762] connection accepted
weave 2015/02/24 20:03:09.266014 ->[192.168.2.254:56762] completed handshake with 7a:b5:2d:25:d1:cf
weave 2015/02/24 20:03:09.266416 ->[7a:b5:2d:25:d1:cf]: connection added
weave 2015/02/24 20:03:09.267726 Discovered remote MAC 02:42:c0:a8:0f:07 at 7a:21:54:68:1a:41
weave 2015/02/24 20:03:09.274689 Discovered remote MAC 02:42:c0:a8:0f:07 at 7a:b5:2d:25:d1:cf
weave 2015/02/24 20:03:09.281272 ->[7a:b5:2d:25:d1:cf]: connection fully established
weave 2015/02/24 20:03:09.281862 EMSGSIZE on send, expecting PMTU update (IP packet was 60082 bytes, payload was 60074 bytes)
weave 2015/02/24 20:03:09.282686 ->[7a:b5:2d:25:d1:cf]: Effective PMTU set to 8921
weave 2015/02/24 20:03:11.591111 ->[192.168.2.254:56814] connection accepted
weave 2015/02/24 20:03:11.591968 ->[192.168.2.254:56814] completed handshake with 7a:8b:d8:d8:4a:88
weave 2015/02/24 20:03:11.592674 ->[7a:8b:d8:d8:4a:88]: connection added
weave 2015/02/24 20:03:11.592779 ->[7a:8b:d8:d8:4a:88]: connection shutting down due to error: Multiple connections to 7a:8b:d8:d8:4a:88 added to 7a:8c:a1:e4:43:13
weave 2015/02/24 20:03:11.600604 Discovered remote MAC 02:42:c0:a8:0e:05 at 7a:21:54:68:1a:41
weave 2015/02/24 20:03:11.621742 Discovered remote MAC 02:42:c0:a8:0e:05 at 7a:8b:d8:d8:4a:88
weave 2015/02/24 20:03:11.624726 ->[192.168.2.254:51414] connection accepted
weave 2015/02/24 20:03:11.625619 ->[192.168.2.254:51414] completed handshake with 7a:8b:d8:d8:4a:88
weave 2015/02/24 20:03:11.629450 ->[7a:8b:d8:d8:4a:88]: connection added
weave 2015/02/24 20:03:11.629472 ->[7a:8b:d8:d8:4a:88]: connection shutting down due to error: Multiple connections to 7a:8b:d8:d8:4a:88 added to 7a:8c:a1:e4:43:13
weave 2015/02/24 20:03:12.279619 ->[7a:8b:d8:d8:4a:88]: connection shutting down due to error: Failed to decode packet: decryption failed; Unable to decrypt UDP packet
weave 2015/02/24 20:03:12.280177 ->[7a:8b:d8:d8:4a:88]: connection deleted
weave 2015/02/24 20:03:12.280677 ->[192.168.1.254:6783] attempting connection
weave 2015/02/24 20:03:12.280783 ->[192.168.4.254:48716] attempting connection
weave 2015/02/24 20:03:12.280866 ->[192.168.4.254:6783] attempting connection
weave 2015/02/24 20:03:12.280969 ->[192.168.1.254:48383] attempting connection
weave 2015/02/24 20:03:12.285462 ->[192.168.2.254:51417] connection accepted
weave 2015/02/24 20:03:12.286256 ->[192.168.2.254:51417] completed handshake with 7a:8b:d8:d8:4a:88
weave 2015/02/24 20:03:12.286966 ->[7a:8b:d8:d8:4a:88]: connection added
weave 2015/02/24 20:03:12.288942 ->[192.168.4.254:48716] error during connection attempt: dial tcp4 192.168.4.254:48716: connection refused
weave 2015/02/24 20:03:12.292296 ->[192.168.1.254:48383] error during connection attempt: dial tcp4 192.168.1.254:48383: connection refused
weave 2015/02/24 20:03:12.296773 ->[192.168.4.254:6783] connection shutting down due to error during handshake: Already have connection to 7a:87:ef:4c:d7:5e at 192.168.2.254:43466
weave 2015/02/24 20:03:12.298027 ->[192.168.1.254:6783] connection shutting down due to error during handshake: Already have connection to 7a:21:54:68:1a:41 at 10.99.185.203:6783
weave 2015/02/24 20:03:17.185445 ->[192.168.2.254:56936] connection accepted
weave 2015/02/24 20:03:17.186217 ->[192.168.2.254:56936] connection shutting down due to error during handshake: Already have connection to 7a:87:ef:4c:d7:5e at 192.168.2.254:43466
weave 2015/02/24 20:03:23.625999 ->[192.168.2.254:57077] connection accepted
weave 2015/02/24 20:03:23.627191 ->[192.168.2.254:57077] completed handshake with 7a:8b:d8:d8:4a:88
weave 2015/02/24 20:03:23.627511 ->[7a:8b:d8:d8:4a:88]: connection shutting down due to error: Multiple connections to 7a:8b:d8:d8:4a:88 added to 7a:8c:a1:e4:43:13
weave 2015/02/24 20:03:23.628780 ->[7a:8b:d8:d8:4a:88]: connection added
weave 2015/02/24 20:03:23.633172 ->[192.168.2.254:51428] connection accepted
weave 2015/02/24 20:03:23.634427 ->[192.168.2.254:51428] completed handshake with 7a:8b:d8:d8:4a:88
weave 2015/02/24 20:03:23.634583 ->[7a:8b:d8:d8:4a:88]: connection shutting down due to error: Multiple connections to 7a:8b:d8:d8:4a:88 added to 7a:8c:a1:e4:43:13
weave 2015/02/24 20:03:23.641148 ->[192.168.2.254:51429] connection accepted
weave 2015/02/24 20:03:23.641846 ->[192.168.2.254:51429] completed handshake with 7a:8b:d8:d8:4a:88
weave 2015/02/24 20:03:23.642485 ->[7a:8b:d8:d8:4a:88]: connection added
weave 2015/02/24 20:03:23.642556 ->[7a:8b:d8:d8:4a:88]: connection shutting down due to error: Multiple connections to 7a:8b:d8:d8:4a:88 added to 7a:8c:a1:e4:43:13
weave 2015/02/24 20:03:23.661916 ->[7a:8b:d8:d8:4a:88]: connection shutting down due to error: Failed to decode packet: decryption failed; Unable to decrypt UDP packet
weave 2015/02/24 20:03:23.662391 ->[7a:8b:d8:d8:4a:88]: connection deleted
weave 2015/02/24 20:03:23.663095 ->[192.168.4.254:6783] attempting connection
weave 2015/02/24 20:03:23.663264 ->[192.168.1.254:48383] attempting connection
weave 2015/02/24 20:03:23.663447 ->[192.168.4.254:48716] attempting connection
weave 2015/02/24 20:03:23.663623 ->[192.168.1.254:6783] attempting connection
weave 2015/02/24 20:03:23.666825 ->[192.168.2.254:51431] connection accepted
weave 2015/02/24 20:03:23.667611 ->[192.168.2.254:51431] completed handshake with 7a:8b:d8:d8:4a:88
weave 2015/02/24 20:03:23.668264 ->[7a:8b:d8:d8:4a:88]: connection added
weave 2015/02/24 20:03:23.693755 ->[192.168.1.254:48383] error during connection attempt: dial tcp4 192.168.1.254:48383: connection refused
weave 2015/02/24 20:03:23.709431 ->[192.168.1.254:6783] connection shutting down due to error during handshake: Already have connection to 7a:21:54:68:1a:41 at 10.99.185.203:6783
weave 2015/02/24 20:03:24.146354 Expired MAC 02:42:c0:a8:04:0b at 7a:87:ef:4c:d7:5e
weave 2015/02/24 20:03:24.146497 Expired MAC 02:42:c0:a8:04:0c at 7a:87:ef:4c:d7:5e
weave 2015/02/24 20:03:27.902422 ->[7a:02:0f:ac:19:f4]: connection shutting down due to error: failed to establish UDP connectivity
weave 2015/02/24 20:03:27.902835 ->[7a:02:0f:ac:19:f4]: connection deleted
weave 2015/02/24 20:03:27.903528 ->[192.168.4.254:59426] attempting connection
weave 2015/02/24 20:03:27.903704 ->[192.168.1.254:37885] attempting connection
weave 2015/02/24 20:03:27.903871 ->[192.168.1.254:6783] attempting connection
weave 2015/02/24 20:03:27.921297 ->[192.168.1.254:37885] error during connection attempt: dial tcp4 192.168.1.254:37885: connection refused
weave 2015/02/24 20:03:27.921374 ->[192.168.2.254:46776] connection accepted
weave 2015/02/24 20:03:27.921998 ->[192.168.1.254:6783] connection shutting down due to error during handshake: Already have connection to 7a:21:54:68:1a:41 at 10.99.185.203:6783
weave 2015/02/24 20:03:27.922539 ->[192.168.2.254:46776] completed handshake with 7a:02:0f:ac:19:f4
weave 2015/02/24 20:03:27.922925 ->[7a:02:0f:ac:19:f4]: connection added
weave 2015/02/24 20:03:40.080152 ->[192.168.2.254:57406] connection accepted
weave 2015/02/24 20:03:40.080813 ->[192.168.2.254:57406] completed handshake with 7a:8b:d8:d8:4a:88
weave 2015/02/24 20:03:40.081551 ->[7a:8b:d8:d8:4a:88]: connection added
weave 2015/02/24 20:03:40.081727 ->[7a:8b:d8:d8:4a:88]: connection shutting down due to error: Multiple connections to 7a:8b:d8:d8:4a:88 added to 7a:8c:a1:e4:43:13
weave 2015/02/24 20:03:40.093441 ->[192.168.2.254:51454] connection accepted
weave 2015/02/24 20:03:40.096164 ->[192.168.2.254:51454] completed handshake with 7a:8b:d8:d8:4a:88
weave 2015/02/24 20:03:40.097874 ->[7a:8b:d8:d8:4a:88]: connection shutting down due to error: Multiple connections to 7a:8b:d8:d8:4a:88 added to 7a:8c:a1:e4:43:13
weave 2015/02/24 20:03:40.129819 ->[7a:8b:d8:d8:4a:88]: connection fully established
weave 2015/02/24 20:03:40.130144 EMSGSIZE on send, expecting PMTU update (IP packet was 60082 bytes, payload was 60074 bytes)
weave 2015/02/24 20:03:40.130169 ->[7a:8b:d8:d8:4a:88]: Effective PMTU set to 8921
weave 2015/02/24 20:03:52.204139 ->[7a:02:0f:ac:19:f4]: Cannot forward frame yet - awaiting contact
weave 2015/02/24 20:03:53.203684 ->[7a:02:0f:ac:19:f4]: Cannot forward frame yet - awaiting contact
weave 2015/02/24 20:03:54.207921 ->[7a:02:0f:ac:19:f4]: Cannot forward frame yet - awaiting contact
weave 2015/02/24 20:03:56.950292 ->[7a:02:0f:ac:19:f4]: Cannot forward frame yet - awaiting contact
weave 2015/02/24 20:03:57.922912 ->[7a:02:0f:ac:19:f4]: connection shutting down due to error: failed to establish UDP connectivity
weave 2015/02/24 20:03:57.923314 ->[7a:02:0f:ac:19:f4]: connection deleted
weave 2015/02/24 20:03:57.924292 ->[192.168.1.254:37885] attempting connection
weave 2015/02/24 20:03:57.924458 ->[192.168.1.254:6783] attempting connection
weave 2015/02/24 20:03:57.927489 ->[192.168.2.254:46801] connection accepted
weave 2015/02/24 20:03:57.928331 ->[192.168.2.254:46801] completed handshake with 7a:02:0f:ac:19:f4
weave 2015/02/24 20:03:57.929000 ->[7a:02:0f:ac:19:f4]: connection added
weave 2015/02/24 20:03:57.929993 ->[192.168.1.254:37885] error during connection attempt: dial tcp4 192.168.1.254:37885: connection refused
weave 2015/02/24 20:03:57.947244 ->[7a:02:0f:ac:19:f4]: Cannot forward frame yet - awaiting contact
weave 2015/02/24 20:03:57.949009 ->[192.168.1.254:6783] connection shutting down due to error during handshake: Already have connection to 7a:21:54:68:1a:41 at 10.99.185.203:6783
weave 2015/02/24 20:03:58.947818 ->[7a:02:0f:ac:19:f4]: Cannot forward frame yet - awaiting contact
weave 2015/02/24 20:04:01.471911 ->[7a:02:0f:ac:19:f4]: Cannot forward frame yet - awaiting contact
weave 2015/02/24 20:04:02.472124 ->[7a:02:0f:ac:19:f4]: Cannot forward frame yet - awaiting contact
weave 2015/02/24 20:04:03.472171 ->[7a:02:0f:ac:19:f4]: Cannot forward frame yet - awaiting contact
weave 2015/02/24 20:04:04.275390 Discovered remote MAC 02:42:c0:a8:04:31 at 7a:87:ef:4c:d7:5e
weave 2015/02/24 20:04:04.636086 Discovered remote MAC 02:42:c0:a8:04:33 at 7a:87:ef:4c:d7:5e
weave 2015/02/24 20:04:04.663235 ->[7a:02:0f:ac:19:f4]: Cannot forward frame yet - awaiting contact
weave 2015/02/24 20:04:04.822977 Discovered remote MAC 02:42:c0:a8:04:32 at 7a:87:ef:4c:d7:5e
weave 2015/02/24 20:04:05.667035 ->[7a:02:0f:ac:19:f4]: Cannot forward frame yet - awaiting contact
weave 2015/02/24 20:04:07.864592 ->[7a:02:0f:ac:19:f4]: Cannot forward frame yet - awaiting contact
weave 2015/02/24 20:04:09.281340 ->[7a:b5:2d:25:d1:cf]: connection shutting down due to error: read tcp4 192.168.2.254:56762: i/o timeout
weave 2015/02/24 20:04:09.281592 ->[7a:b5:2d:25:d1:cf]: connection deleted
weave 2015/02/24 20:04:09.282335 ->[192.168.4.254:39140] attempting connection
weave 2015/02/24 20:04:09.282437 ->[192.168.1.254:6783] attempting connection
weave 2015/02/24 20:04:09.282595 ->[192.168.1.254:51106] attempting connection
weave 2015/02/24 20:04:09.290593 ->[192.168.2.254:36562] connection accepted
weave 2015/02/24 20:04:09.291575 ->[192.168.2.254:36562] completed handshake with 7a:b5:2d:25:d1:cf
weave 2015/02/24 20:04:09.292279 ->[7a:b5:2d:25:d1:cf]: connection added
weave 2015/02/24 20:04:10.289575 ->[7a:b5:2d:25:d1:cf]: connection shutting down due to error: Failed to decode packet: decryption failed; Unable to decrypt UDP packet
weave 2015/02/24 20:04:10.289800 ->[7a:b5:2d:25:d1:cf]: connection deleted
weave 2015/02/24 20:04:10.291848 ->[192.168.1.254:51106] error during connection attempt: dial tcp4 192.168.1.254:51106: connection refused
weave 2015/02/24 20:04:10.293917 ->[192.168.1.254:6783] connection shutting down due to error during handshake: Already have connection to 7a:21:54:68:1a:41 at 10.99.185.203:6783
weave 2015/02/24 20:04:10.306662 ->[192.168.2.254:36565] connection accepted
weave 2015/02/24 20:04:10.308484 ->[192.168.2.254:36565] completed handshake with 7a:b5:2d:25:d1:cf
weave 2015/02/24 20:04:10.309153 ->[7a:b5:2d:25:d1:cf]: connection added
weave 2015/02/24 20:04:10.315691 ->[192.168.2.254:58039] connection accepted
weave 2015/02/24 20:04:10.346478 ->[192.168.2.254:58039] completed handshake with 7a:b5:2d:25:d1:cf
weave 2015/02/24 20:04:10.347095 ->[7a:b5:2d:25:d1:cf]: connection added
weave 2015/02/24 20:04:10.347118 ->[7a:b5:2d:25:d1:cf]: connection shutting down due to error: Multiple connections to 7a:b5:2d:25:d1:cf added to 7a:8c:a1:e4:43:13
weave 2015/02/24 20:04:10.355307 Discovered remote MAC 02:42:c0:a8:0f:07 at 7a:21:54:68:1a:41
weave 2015/02/24 20:04:10.355379 Discovered remote MAC 02:42:c0:a8:0f:07 at 7a:b5:2d:25:d1:cf
weave 2015/02/24 20:04:11.341501 ->[10.9.168.20:6783] attempting connection
weave 2015/02/24 20:04:11.343229 ->[10.9.168.20:6783] connection shutting down due to error during handshake: Already have connection to 7a:87:ef:4c:d7:5e at 192.168.2.254:43466
weave 2015/02/24 20:04:17.203182 ->[192.168.4.254:59426] error during connection attempt: dial tcp4 192.168.4.254:59426: connection refused
weave 2015/02/24 20:04:17.203309 ->[192.168.4.254:48716] error during connection attempt: dial tcp4 192.168.4.254:48716: connection refused
weave 2015/02/24 20:04:17.215443 ->[192.168.2.254:58197] connection accepted
weave 2015/02/24 20:04:17.220417 ->[192.168.2.254:58197] connection shutting down due to error during handshake: Already have connection to 7a:87:ef:4c:d7:5e at 192.168.2.254:43466
weave 2015/02/24 20:04:17.222657 ->[192.168.4.254:6783] connection shutting down due to error during handshake: Already have connection to 7a:87:ef:4c:d7:5e at 192.168.2.254:43466
weave 2015/02/24 20:04:20.315151 Discovered remote MAC 02:42:c0:a8:04:37 at 7a:87:ef:4c:d7:5e
weave 2015/02/24 20:04:23.048036 ->[7a:02:0f:ac:19:f4]: Cannot forward frame yet - awaiting contact
weave 2015/02/24 20:04:24.045548 ->[7a:02:0f:ac:19:f4]: Cannot forward frame yet - awaiting contact
weave 2015/02/24 20:04:24.146860 Expired MAC 02:42:c0:a8:04:0f at 7a:87:ef:4c:d7:5e
weave 2015/02/24 20:04:25.045530 ->[7a:02:0f:ac:19:f4]: Cannot forward frame yet - awaiting contact
weave 2015/02/24 20:04:26.543545 ->[7a:02:0f:ac:19:f4]: Cannot forward frame yet - awaiting contact
weave 2015/02/24 20:04:27.541517 ->[7a:02:0f:ac:19:f4]: Cannot forward frame yet - awaiting contact
weave 2015/02/24 20:04:27.928641 ->[7a:02:0f:ac:19:f4]: connection shutting down due to error: failed to establish UDP connectivity
weave 2015/02/24 20:04:27.928881 ->[7a:02:0f:ac:19:f4]: connection deleted
weave 2015/02/24 20:04:27.929272 ->[192.168.1.254:37885] attempting connection
weave 2015/02/24 20:04:27.929424 ->[192.168.1.254:6783] attempting connection
weave 2015/02/24 20:04:27.929513 ->[192.168.4.254:60854] attempting connection
weave 2015/02/24 20:04:27.929599 ->[192.168.4.254:6783] attempting connection
weave 2015/02/24 20:04:27.931217 ->[192.168.1.254:37885] error during connection attempt: dial tcp4 192.168.1.254:37885: connection refused
weave 2015/02/24 20:04:27.934233 ->[192.168.1.254:6783] connection shutting down due to error during handshake: Already have connection to 7a:21:54:68:1a:41 at 10.99.185.203:6783
weave 2015/02/24 20:04:27.934743 ->[192.168.2.254:46828] connection accepted
weave 2015/02/24 20:04:27.935508 ->[192.168.2.254:46828] completed handshake with 7a:02:0f:ac:19:f4
weave 2015/02/24 20:04:27.935935 ->[7a:02:0f:ac:19:f4]: connection added
weave 2015/02/24 20:04:27.951002 ->[192.168.4.254:60854] error during connection attempt: dial tcp4 192.168.4.254:60854: connection refused
weave 2015/02/24 20:04:28.541521 ->[7a:02:0f:ac:19:f4]: Cannot forward frame yet - awaiting contact
weave 2015/02/24 20:04:28.946960 ->[192.168.4.254:6783] connection shutting down due to error during handshake: Already have connection to 7a:87:ef:4c:d7:5e at 192.168.2.254:43466
weave 2015/02/24 20:04:30.130134 ->[7a:02:0f:ac:19:f4]: Cannot forward frame yet - awaiting contact
weave 2015/02/24 20:04:31.129597 ->[7a:02:0f:ac:19:f4]: Cannot forward frame yet - awaiting contact
weave 2015/02/24 20:04:32.129530 ->[7a:02:0f:ac:19:f4]: Cannot forward frame yet - awaiting contact
weave 2015/02/24 20:04:34.208640 ->[7a:02:0f:ac:19:f4]: Cannot forward frame yet - awaiting contact
weave 2015/02/24 20:04:34.917125 ->[192.168.2.254:58584] connection accepted
weave 2015/02/24 20:04:34.917972 ->[192.168.2.254:58584] connection shutting down due to error during handshake: Already have connection to 7a:8f:17:40:9e:ce at 192.168.2.254:51743
weave 2015/02/24 20:04:35.205515 ->[7a:02:0f:ac:19:f4]: Cannot forward frame yet - awaiting contact
weave 2015/02/24 20:04:36.205553 ->[7a:02:0f:ac:19:f4]: Cannot forward frame yet - awaiting contact
weave 2015/02/24 20:04:37.400786 ->[7a:02:0f:ac:19:f4]: Cannot forward frame yet - awaiting contact
weave 2015/02/24 20:04:38.397533 ->[7a:02:0f:ac:19:f4]: Cannot forward frame yet - awaiting contact
weave 2015/02/24 20:04:39.397509 ->[7a:02:0f:ac:19:f4]: Cannot forward frame yet - awaiting contact
weave 2015/02/24 20:04:40.128278 ->[192.168.2.254:51501] connection accepted
weave 2015/02/24 20:04:40.128993 ->[192.168.2.254:51501] connection shutting down due to error during handshake: Already have connection to 7a:8b:d8:d8:4a:88 at 192.168.2.254:57406
weave 2015/02/24 20:04:40.129566 ->[7a:8b:d8:d8:4a:88]: connection shutting down due to error: read tcp4 192.168.2.254:57406: i/o timeout
weave 2015/02/24 20:04:40.129713 ->[7a:8b:d8:d8:4a:88]: connection deleted
weave 2015/02/24 20:04:40.130330 ->[192.168.1.254:48383] attempting connection
weave 2015/02/24 20:04:40.130347 ->[192.168.4.254:48716] attempting connection
weave 2015/02/24 20:04:40.130333 ->[192.168.4.254:6783] attempting connection
weave 2015/02/24 20:04:40.130426 ->[192.168.1.254:6783] attempting connection
weave 2015/02/24 20:04:40.131728 ->[192.168.1.254:48383] error during connection attempt: dial tcp4 192.168.1.254:48383: connection refused
weave 2015/02/24 20:04:40.133796 ->[192.168.1.254:6783] connection shutting down due to error during handshake: Already have connection to 7a:21:54:68:1a:41 at 10.99.185.203:6783
weave 2015/02/24 20:04:40.138378 ->[192.168.4.254:48716] error during connection attempt: dial tcp4 192.168.4.254:48716: connection refused
weave 2015/02/24 20:04:40.158195 ->[192.168.4.254:6783] connection shutting down due to error during handshake: Already have connection to 7a:87:ef:4c:d7:5e at 192.168.2.254:43466
weave 2015/02/24 20:04:40.346707 ->[7a:b5:2d:25:d1:cf]: connection shutting down due to error: failed to establish UDP connectivity
weave 2015/02/24 20:04:40.347142 ->[7a:b5:2d:25:d1:cf]: connection deleted
weave 2015/02/24 20:04:40.347696 ->[192.168.1.254:51106] attempting connection
weave 2015/02/24 20:04:40.348982 ->[192.168.1.254:51106] error during connection attempt: dial tcp4 192.168.1.254:51106: connection refused
weave 2015/02/24 20:04:40.350067 ->[192.168.2.254:36588] connection accepted
weave 2015/02/24 20:04:40.351701 ->[192.168.2.254:36588] completed handshake with 7a:b5:2d:25:d1:cf
weave 2015/02/24 20:04:40.352059 ->[7a:b5:2d:25:d1:cf]: connection added
weave 2015/02/24 20:04:40.358011 ->[7a:b5:2d:25:d1:cf]: connection shutting down due to error: Failed to decode packet: decryption failed; Unable to decrypt UDP packet
weave 2015/02/24 20:04:40.358134 ->[7a:b5:2d:25:d1:cf]: connection deleted
weave 2015/02/24 20:04:40.358847 ->[192.168.1.254:51106] attempting connection
weave 2015/02/24 20:04:40.359364 ->[192.168.2.254:58726] connection accepted
weave 2015/02/24 20:04:40.359904 ->[192.168.2.254:58726] completed handshake with 7a:b5:2d:25:d1:cf
weave 2015/02/24 20:04:40.360301 ->[7a:b5:2d:25:d1:cf]: connection added
weave 2015/02/24 20:04:40.362837 ->[192.168.1.254:51106] error during connection attempt: dial tcp4 192.168.1.254:51106: connection refused
weave 2015/02/24 20:04:43.389867 ->[192.168.2.254:51506] connection accepted
weave 2015/02/24 20:04:43.390585 ->[192.168.2.254:51506] completed handshake with 7a:8b:d8:d8:4a:88
weave 2015/02/24 20:04:43.390941 ->[7a:8b:d8:d8:4a:88]: connection added
weave 2015/02/24 20:04:57.935726 ->[7a:02:0f:ac:19:f4]: connection shutting down due to error: failed to establish UDP connectivity
weave 2015/02/24 20:04:57.935991 ->[7a:02:0f:ac:19:f4]: connection deleted
weave 2015/02/24 20:04:57.936591 ->[192.168.4.254:6783] attempting connection
weave 2015/02/24 20:04:57.936754 ->[192.168.4.254:60854] attempting connection
weave 2015/02/24 20:04:57.936835 ->[192.168.1.254:6783] attempting connection
weave 2015/02/24 20:04:57.937038 ->[192.168.1.254:37885] attempting connection
weave 2015/02/24 20:04:57.939673 ->[192.168.2.254:46846] connection accepted
weave 2015/02/24 20:04:57.940466 ->[192.168.2.254:46846] completed handshake with 7a:02:0f:ac:19:f4
weave 2015/02/24 20:04:57.940994 ->[7a:02:0f:ac:19:f4]: connection added
weave 2015/02/24 20:04:58.493558 ->[7a:b5:2d:25:d1:cf]: Cannot forward frame yet - awaiting contact
weave 2015/02/24 20:04:58.493587 ->[7a:8b:d8:d8:4a:88]: Cannot forward frame yet - awaiting contact
weave 2015/02/24 20:04:58.493616 ->[7a:02:0f:ac:19:f4]: Cannot forward frame yet - awaiting contact
weave 2015/02/24 20:04:59.493514 ->[7a:b5:2d:25:d1:cf]: Cannot forward frame yet - awaiting contact
weave 2015/02/24 20:04:59.493651 ->[7a:8b:d8:d8:4a:88]: Cannot forward frame yet - awaiting contact
weave 2015/02/24 20:04:59.494069 ->[7a:02:0f:ac:19:f4]: Cannot forward frame yet - awaiting contact
weave 2015/02/24 20:05:00.493536 ->[7a:b5:2d:25:d1:cf]: Cannot forward frame yet - awaiting contact
weave 2015/02/24 20:05:00.493680 ->[7a:8b:d8:d8:4a:88]: Cannot forward frame yet - awaiting contact
weave 2015/02/24 20:05:00.494135 ->[7a:02:0f:ac:19:f4]: Cannot forward frame yet - awaiting contact
weave 2015/02/24 20:05:10.360150 ->[7a:b5:2d:25:d1:cf]: connection shutting down due to error: failed to establish UDP connectivity
weave 2015/02/24 20:05:10.360945 ->[7a:b5:2d:25:d1:cf]: connection deleted
weave 2015/02/24 20:05:10.361851 ->[192.168.1.254:51106] attempting connection
weave 2015/02/24 20:05:10.367619 ->[192.168.2.254:36644] connection accepted
weave 2015/02/24 20:05:10.368934 ->[192.168.1.254:51106] error during connection attempt: dial tcp4 192.168.1.254:51106: connection refused
weave 2015/02/24 20:05:10.370464 ->[192.168.2.254:36644] completed handshake with 7a:b5:2d:25:d1:cf
weave 2015/02/24 20:05:10.371201 ->[7a:b5:2d:25:d1:cf]: connection added
weave 2015/02/24 20:05:10.868084 ->[7a:b5:2d:25:d1:cf]: connection shutting down due to error: Failed to decode packet: decryption failed; Unable to decrypt UDP packet
weave 2015/02/24 20:05:10.868355 ->[7a:b5:2d:25:d1:cf]: connection deleted
weave 2015/02/24 20:05:10.868900 ->[192.168.1.254:51106] attempting connection
weave 2015/02/24 20:05:10.869844 ->[192.168.1.254:51106] error during connection attempt: dial tcp4 192.168.1.254:51106: connection refused
weave 2015/02/24 20:05:10.872604 ->[192.168.2.254:36648] connection accepted
weave 2015/02/24 20:05:10.873900 ->[192.168.2.254:36648] completed handshake with 7a:b5:2d:25:d1:cf
weave 2015/02/24 20:05:10.874299 ->[7a:b5:2d:25:d1:cf]: connection added
weave 2015/02/24 20:05:10.875728 ->[192.168.2.254:59357] connection accepted
weave 2015/02/24 20:05:10.876194 ->[192.168.2.254:59357] completed handshake with 7a:b5:2d:25:d1:cf
weave 2015/02/24 20:05:10.876554 ->[7a:b5:2d:25:d1:cf]: connection added
weave 2015/02/24 20:05:10.876567 ->[7a:b5:2d:25:d1:cf]: connection shutting down due to error: Multiple connections to 7a:b5:2d:25:d1:cf added to 7a:8c:a1:e4:43:13
weave 2015/02/24 20:05:10.891768 ->[7a:b5:2d:25:d1:cf]: connection fully established
weave 2015/02/24 20:05:10.892280 EMSGSIZE on send, expecting PMTU update (IP packet was 60082 bytes, payload was 60074 bytes)
weave 2015/02/24 20:05:10.892303 ->[7a:b5:2d:25:d1:cf]: Effective PMTU set to 8921
weave 2015/02/24 20:05:12.038548 Discovered remote MAC 02:42:c0:a8:04:34 at 7a:87:ef:4c:d7:5e
weave 2015/02/24 20:05:12.393095 ->[192.168.4.254:39140] error during connection attempt: dial tcp4 192.168.4.254:39140: connection refused
weave 2015/02/24 20:05:12.590475 Discovered remote MAC 02:42:c0:a8:04:35 at 7a:87:ef:4c:d7:5e
weave 2015/02/24 20:05:12.790484 Discovered remote MAC 02:42:c0:a8:04:36 at 7a:87:ef:4c:d7:5e
weave 2015/02/24 20:05:12.975366 ->[192.168.1.254:6783] connection shutting down due to error during handshake: Already have connection to 7a:21:54:68:1a:41 at 10.99.185.203:6783
weave 2015/02/24 20:05:12.982374 ->[192.168.4.254:60854] error during connection attempt: dial tcp4 192.168.4.254:60854: connection refused
weave 2015/02/24 20:05:12.983122 ->[192.168.1.254:37885] error during connection attempt: dial tcp4 192.168.1.254:37885: connection refused
weave 2015/02/24 20:05:12.990534 ->[192.168.4.254:6783] connection shutting down due to error during handshake: Already have connection to 7a:87:ef:4c:d7:5e at 192.168.2.254:43466
weave 2015/02/24 20:05:13.390814 ->[7a:8b:d8:d8:4a:88]: connection shutting down due to error: failed to establish UDP connectivity
weave 2015/02/24 20:05:13.391059 ->[7a:8b:d8:d8:4a:88]: connection deleted
weave 2015/02/24 20:05:13.391772 ->[192.168.4.254:48716] attempting connection
weave 2015/02/24 20:05:13.391872 ->[192.168.4.254:6783] attempting connection
weave 2015/02/24 20:05:13.392021 ->[192.168.1.254:48383] attempting connection
weave 2015/02/24 20:05:13.392160 ->[192.168.1.254:6783] attempting connection
weave 2015/02/24 20:05:13.406300 ->[192.168.2.254:51554] connection accepted
weave 2015/02/24 20:05:13.413732 ->[192.168.2.254:51554] completed handshake with 7a:8b:d8:d8:4a:88
weave 2015/02/24 20:05:13.415084 ->[7a:8b:d8:d8:4a:88]: connection added
weave 2015/02/24 20:05:14.080939 ->[192.168.2.254:59422] connection accepted
weave 2015/02/24 20:05:14.111336 ->[7a:8b:d8:d8:4a:88]: connection shutting down due to error: Failed to decode packet: decryption failed; Unable to decrypt UDP packet
weave 2015/02/24 20:05:14.111446 ->[7a:8b:d8:d8:4a:88]: connection deleted
weave 2015/02/24 20:05:14.112465 ->[192.168.2.254:59422] completed handshake with 7a:8b:d8:d8:4a:88
weave 2015/02/24 20:05:14.112791 ->[7a:8b:d8:d8:4a:88]: connection added
weave 2015/02/24 20:05:14.116828 Discovered remote MAC 02:42:c0:a8:0e:05 at 7a:21:54:68:1a:41
weave 2015/02/24 20:05:14.119626 Discovered remote MAC 02:42:c0:a8:0e:05 at 7a:8b:d8:d8:4a:88
weave 2015/02/24 20:05:15.611279 ->[7a:8b:d8:d8:4a:88]: connection fully established
weave 2015/02/24 20:05:15.611501 EMSGSIZE on send, expecting PMTU update (IP packet was 60082 bytes, payload was 60074 bytes)
weave 2015/02/24 20:05:15.611526 ->[7a:8b:d8:d8:4a:88]: Effective PMTU set to 8921
weave 2015/02/24 20:05:16.302088 ->[192.168.2.254:59476] connection accepted
weave 2015/02/24 20:05:16.318685 ->[192.168.2.254:59476] completed handshake with 7a:02:0f:ac:19:f4
weave 2015/02/24 20:05:16.318736 ->[7a:02:0f:ac:19:f4]: connection shutting down due to error: Multiple connections to 7a:02:0f:ac:19:f4 added to 7a:8c:a1:e4:43:13
weave 2015/02/24 20:05:16.353354 ->[7a:02:0f:ac:19:f4]: connection shutting down due to error: Failed to decode packet: decryption failed; Unable to decrypt UDP packet
weave 2015/02/24 20:05:16.353784 ->[7a:02:0f:ac:19:f4]: connection deleted
weave 2015/02/24 20:05:16.354514 ->[192.168.1.254:37885] attempting connection
weave 2015/02/24 20:05:16.354620 ->[192.168.4.254:60854] attempting connection
weave 2015/02/24 20:05:16.357561 ->[192.168.2.254:46874] connection accepted
weave 2015/02/24 20:05:16.358311 ->[192.168.2.254:46874] completed handshake with 7a:02:0f:ac:19:f4
weave 2015/02/24 20:05:16.358628 ->[7a:02:0f:ac:19:f4]: connection added
weave 2015/02/24 20:05:16.362781 ->[192.168.1.254:37885] error during connection attempt: dial tcp4 192.168.1.254:37885: connection refused
weave 2015/02/24 20:05:16.362844 ->[192.168.4.254:60854] error during connection attempt: dial tcp4 192.168.4.254:60854: connection refused
weave 2015/02/24 20:05:16.402120 ->[192.168.4.254:6783] connection shutting down due to error during handshake: Already have connection to 7a:87:ef:4c:d7:5e at 192.168.2.254:43466
weave 2015/02/24 20:05:16.408781 ->[192.168.4.254:48716] error during connection attempt: dial tcp4 192.168.4.254:48716: connection refused
weave 2015/02/24 20:05:16.416215 ->[192.168.1.254:6783] connection shutting down due to error during handshake: Already have connection to 7a:21:54:68:1a:41 at 10.99.185.203:6783
weave 2015/02/24 20:05:16.418201 ->[192.168.1.254:48383] error during connection attempt: dial tcp4 192.168.1.254:48383: connection refused
weave 2015/02/24 20:05:17.235033 ->[192.168.2.254:59495] connection accepted
weave 2015/02/24 20:05:17.235540 ->[192.168.2.254:59495] connection shutting down due to error during handshake: Already have connection to 7a:87:ef:4c:d7:5e at 192.168.2.254:43466
weave 2015/02/24 20:05:24.147495 Expired MAC 02:42:c0:a8:04:11 at 7a:87:ef:4c:d7:5e
weave 2015/02/24 20:05:24.147528 Expired MAC 02:42:c0:a8:04:13 at 7a:87:ef:4c:d7:5e
weave 2015/02/24 20:05:24.147541 Expired MAC 02:42:c0:a8:04:12 at 7a:87:ef:4c:d7:5e
weave 2015/02/24 20:05:24.147585 Expired MAC 02:42:c0:a8:04:10 at 7a:87:ef:4c:d7:5e
weave 2015/02/24 20:05:24.147596 Expired MAC 02:42:c0:a8:04:14 at 7a:87:ef:4c:d7:5e
weave 2015/02/24 20:05:46.358729 ->[7a:02:0f:ac:19:f4]: connection shutting down due to error: failed to establish UDP connectivity
weave 2015/02/24 20:05:46.359143 ->[7a:02:0f:ac:19:f4]: connection deleted
weave 2015/02/24 20:05:46.359770 ->[192.168.1.254:37885] attempting connection
weave 2015/02/24 20:05:46.359946 ->[192.168.1.254:6783] attempting connection
weave 2015/02/24 20:05:46.360061 ->[192.168.4.254:6783] attempting connection
weave 2015/02/24 20:05:46.360144 ->[192.168.4.254:34091] attempting connection
weave 2015/02/24 20:05:46.366337 ->[192.168.2.254:46898] connection accepted
weave 2015/02/24 20:05:46.367384 ->[192.168.2.254:46898] completed handshake with 7a:02:0f:ac:19:f4
weave 2015/02/24 20:05:46.367928 ->[7a:02:0f:ac:19:f4]: connection added
weave 2015/02/24 20:05:47.366631 ->[192.168.1.254:37885] error during connection attempt: dial tcp4 192.168.1.254:37885: connection refused
weave 2015/02/24 20:05:47.389590 ->[192.168.4.254:34091] error during connection attempt: dial tcp4 192.168.4.254:34091: connection refused
weave 2015/02/24 20:05:47.390524 ->[192.168.1.254:6783] connection shutting down due to error during handshake: Already have connection to 7a:21:54:68:1a:41 at 10.99.185.203:6783
weave 2015/02/24 20:05:47.391186 ->[192.168.4.254:6783] connection shutting down due to error during handshake: Already have connection to 7a:87:ef:4c:d7:5e at 192.168.2.254:43466
weave 2015/02/24 20:05:53.815920 ->[7a:02:0f:ac:19:f4]: Cannot forward frame yet - awaiting contact
weave 2015/02/24 20:05:54.815964 ->[7a:02:0f:ac:19:f4]: Cannot forward frame yet - awaiting contact
weave 2015/02/24 20:05:55.830275 ->[7a:02:0f:ac:19:f4]: Cannot forward frame yet - awaiting contact
weave 2015/02/24 20:05:58.193571 ->[7a:02:0f:ac:19:f4]: Cannot forward frame yet - awaiting contact
weave 2015/02/24 20:05:59.196209 ->[7a:02:0f:ac:19:f4]: Cannot forward frame yet - awaiting contact
weave 2015/02/24 20:05:59.496691 ->[7a:02:0f:ac:19:f4]: Cannot forward frame yet - awaiting contact
```

**Comment by bboreham** [comment]
Is the network traffic to/from port 6783, which weave uses?  And if so, is it UDP (data) or TCP (control)?

Can you get a packet capture?

**Comment by bmurphy1976** [comment]
I was able to narrow things down a bit more.  It appears to be limited to certain interfaces and the traffic does *not* go over eth0, so it appears to be localized to the instance.  I'm going to do some more digging.

```
----total-cpu-usage---- --net/eth0--net/veth31c-net/vethwep--net/weave---net/total- -------most-expensive-cpu-process-------
usr sys idl wai hiq siq| recv  send: recv  send: recv  send: recv  send: recv  send|process              pid  cpu read write
  7   5  88   0   0   0|   0     0 :   0     0 :   0     0 :   0     0 :   0     0 |revealcloud          8768 0.1%3914B 685B
 40  44   8   0   0   7|4666B 9089B:  56M  552B: 126B   57M:  56M   57M: 113M  115M|weaver               23750 51%   0   56M
 48  40   6   0   0   6|7291B 8037B:  54M  384B: 116B   55M:  54M   55M: 108M  110M|weaver               23750 49%   0   54M
 58  35   2   0   0   5|  13k   12k:  35M  266B:  42B   36M:  35M   36M:  70M   72M|weaver               23750 35%   0   35M
 66  31   0   0   0   4|7825B 8247B:  27M  164B:  42B   27M:  27M   27M:  53M   55M|scout                1761  47%   0    0
 57  35   3   0   0   4|  13k   18k:  37M  542B: 158B   37M:  37M   37M:  73M   75M|weaver               23750 37%   0   37M
 45  40   7   0   0   7|8867B   40k:  54M  850B: 200B   55M:  54M   55M: 107M  109M|weaver               23750 47%   0   53M
 46  41   7   0   0   5|  99k   13k:  53M 1963B: 126B   54M:  53M   54M: 106M  107M|weaver               23750 48%1405B  52M
 43  43   8   0   0   6|  17k   23k:  55M 9923B:1061B   56M:  55M   56M: 110M  112M|weaver               23750 50%5082B  55M
 47  41   6   0   0   6|  10k 9865B:  48M  820B: 210B   49M:  48M   50M:  97M   99M|weaver               23750 49%   0   51M^
```

**Comment by bmurphy1976** [comment]
At the moment, there appears to be two interfaces contributing to the network traffic: vethda62a1e which is the interface assigned to the "weave container" and the weave bridge interface (weave create-bridge):

```
# tcpdump -i weave -c 20
tcpdump: verbose output suppressed, use -v or -vv for full protocol decode
listening on weave, link-type EN10MB (Ethernet), capture size 65535 bytes
03:44:18.240224 IP ip-192-168-2-22.ec2.internal.6783 > ip-192-168-2-254.ec2.internal.57494: UDP, length 4525
03:44:18.240278 IP ip-192-168-2-254.ec2.internal.6783 > ip-192-168-13-7.ec2.internal.6783: UDP, length 4525
03:44:18.240389 IP ip-192-168-2-22.ec2.internal.6783 > ip-192-168-2-254.ec2.internal.57494: UDP, length 8968
03:44:18.240436 IP ip-192-168-2-254.ec2.internal.6783 > ip-192-168-13-7.ec2.internal.6783: UDP, length 8968
03:44:18.240446 IP ip-192-168-2-254.ec2.internal > ip-192-168-13-7.ec2.internal: udp
03:44:18.240509 IP ip-192-168-2-22.ec2.internal.6783 > ip-192-168-2-254.ec2.internal.57494: UDP, length 776
03:44:18.240548 IP ip-192-168-2-254.ec2.internal.6783 > ip-192-168-13-7.ec2.internal.6783: UDP, length 776
03:44:18.240641 IP ip-192-168-2-22.ec2.internal.6783 > ip-192-168-2-254.ec2.internal.57494: UDP, length 8968
03:44:18.240692 IP ip-192-168-2-254.ec2.internal.6783 > ip-192-168-13-7.ec2.internal.6783: UDP, length 8968
03:44:18.240703 IP ip-192-168-2-254.ec2.internal > ip-192-168-13-7.ec2.internal: udp
03:44:18.240776 IP ip-192-168-2-22.ec2.internal.6783 > ip-192-168-2-254.ec2.internal.57494: UDP, length 152
03:44:18.240814 IP ip-192-168-2-254.ec2.internal.6783 > ip-192-168-13-7.ec2.internal.6783: UDP, length 152
03:44:18.240911 IP ip-192-168-2-22.ec2.internal.6783 > ip-192-168-2-254.ec2.internal.40222: UDP, length 8968
03:44:18.240965 IP ip-192-168-2-254.ec2.internal.6783 > ip-192-168-16-41.ec2.internal.6783: UDP, length 8968
03:44:18.240975 IP ip-192-168-2-254.ec2.internal > ip-192-168-16-41.ec2.internal: udp
03:44:18.241043 IP ip-192-168-2-22.ec2.internal.6783 > ip-192-168-2-254.ec2.internal.40222: UDP, length 1608
03:44:18.241089 IP ip-192-168-2-254.ec2.internal.6783 > ip-192-168-16-41.ec2.internal.6783: UDP, length 1608
03:44:18.241195 IP ip-192-168-2-22.ec2.internal.6783 > ip-192-168-2-254.ec2.internal.40222: UDP, length 8968
03:44:18.241253 IP ip-192-168-2-254.ec2.internal.6783 > ip-192-168-16-41.ec2.internal.6783: UDP, length 8968
03:44:18.241266 IP ip-192-168-2-254.ec2.internal > ip-192-168-16-41.ec2.internal: udp
20 packets captured
47 packets received by filter
0 packets dropped by kernel

# tcpdump -i vethda62a1e -c 20
tcpdump: WARNING: vethda62a1e: no IPv4 address assigned
tcpdump: verbose output suppressed, use -v or -vv for full protocol decode
listening on vethda62a1e, link-type EN10MB (Ethernet), capture size 65535 bytes
03:44:23.473409 IP ip-192-168-2-22.ec2.internal.6783 > ip-192-168-2-254.ec2.internal.57494: UDP, length 8968
03:44:23.473521 IP ip-192-168-2-22.ec2.internal.6783 > ip-192-168-2-254.ec2.internal.40222: UDP, length 8968
03:44:23.473642 IP ip-192-168-2-22.ec2.internal.6783 > ip-192-168-2-254.ec2.internal.40222: UDP, length 2024
03:44:23.473748 IP ip-192-168-2-22.ec2.internal.6783 > ip-192-168-2-254.ec2.internal.57494: UDP, length 3672
03:44:23.473889 IP ip-192-168-2-22.ec2.internal.6783 > ip-192-168-2-254.ec2.internal.57494: UDP, length 8968
03:44:23.474132 IP ip-192-168-2-22.ec2.internal.6783 > ip-192-168-2-254.ec2.internal.57494: UDP, length 4376
03:44:23.474271 IP ip-192-168-2-22.ec2.internal.6783 > ip-192-168-2-254.ec2.internal.57494: UDP, length 8968
03:44:23.474548 IP ip-192-168-2-22.ec2.internal.6783 > ip-192-168-2-254.ec2.internal.57494: UDP, length 3480
03:44:23.474687 IP ip-192-168-2-22.ec2.internal.6783 > ip-192-168-2-254.ec2.internal.57494: UDP, length 8968
03:44:23.474820 IP ip-192-168-2-22.ec2.internal.6783 > ip-192-168-2-254.ec2.internal.57494: UDP, length 3480
03:44:23.474982 IP ip-192-168-2-22.ec2.internal.6783 > ip-192-168-2-254.ec2.internal.57494: UDP, length 8968
03:44:23.475109 IP ip-192-168-2-22.ec2.internal.6783 > ip-192-168-2-254.ec2.internal.40222: UDP, length 8968
03:44:23.475237 IP ip-192-168-2-22.ec2.internal.6783 > ip-192-168-2-254.ec2.internal.40222: UDP, length 1816
03:44:23.475344 IP ip-192-168-2-22.ec2.internal.6783 > ip-192-168-2-254.ec2.internal.57494: UDP, length 3480
03:44:23.475486 IP ip-192-168-2-22.ec2.internal.6783 > ip-192-168-2-254.ec2.internal.40222: UDP, length 8968
03:44:23.475630 IP ip-192-168-2-22.ec2.internal.6783 > ip-192-168-2-254.ec2.internal.57494: UDP, length 8968
03:44:23.475763 IP ip-192-168-2-22.ec2.internal.6783 > ip-192-168-2-254.ec2.internal.40222: UDP, length 3896
03:44:23.475882 IP ip-192-168-2-22.ec2.internal.6783 > ip-192-168-2-254.ec2.internal.57494: UDP, length 3640
03:44:23.476278 IP ip-192-168-2-22.ec2.internal.6783 > ip-192-168-2-254.ec2.internal.40222: UDP, length 8968
03:44:23.476423 IP ip-192-168-2-22.ec2.internal.6783 > ip-192-168-2-254.ec2.internal.57494: UDP, length 8968
20 packets captured
45 packets received by filter
0 packets dropped by kernel

# docker inspect weave | grep 192
        "Gateway": "192.168.2.254",
        "IPAddress": "192.168.2.22",
```

Eventually it settles down.  I'm not sure if it comes back on its own, but it definitely comes back if I manually restart the weave container.

**Comment by bboreham** [comment]
Thanks, it's very helpful that you did that 'docker inspect' - it says that what we're seeing in those captures is traffic between the weave container (192.168.2.22) and the docker bridge (192.168.2.254), and then traffic between the docker bridge and other IP addresses like 192-168-13-7.  

This traffic should definitely not be on the weave bridge.

"vethda62a1e" looks like a veth created by Docker; the traffic you show is expected there.

It may help to see your iptables rules; the `iptables-save` command can export them all in one go.

**Comment by bmurphy1976** [comment]
Here are the iptables rules:

https://gist.github.com/bmurphy1976/6434b97da136a5e52a8f

**Comment by bmurphy1976** [comment]
Looking through the rules I also see a holdover from when the weave interface was configured with a bad network:

```
-A POSTROUTING -s 192.0.0.0/8 ! -o weave -j MASQUERADE
-A WEAVE ! -s 192.0.0.0/8 -o weave -j MASQUERADE
-A WEAVE -s 192.0.0.0/8 ! -o weave -j MASQUERADE
-A WEAVE ! -s 192.168.0.0/16 -o weave -j MASQUERADE
-A WEAVE -s 192.168.0.0/16 ! -o weave -j MASQUERADE
```

should be 192.168.0.0/16 not /8.  The /8 was a mis-configuration we deployed last week.

I'm tempted to reprovision this instance so it comes up in a known clean state.  I could still be fighting cruft from this earlier misconfiguration, but I'm also hesitant because if the problem goes away I may not be able to reproduce it and it could come back to bite us later.

**Comment by bboreham** [comment]
I'm confused where all these come from:

````
-A FORWARD -d 192.168.1.23/32 ! -i weave -o weave -p udp -m udp --dport 6783 -j ACCEPT
-A FORWARD -d 192.168.1.23/32 ! -i weave -o weave -p tcp -m tcp --dport 6783 -j ACCEPT
-A FORWARD -d 192.168.1.21/32 ! -i weave -o weave -p tcp -m tcp --dport 3000 -j ACCEPT
-A FORWARD -d 192.168.1.16/32 ! -i weave -o weave -p tcp -m tcp --dport 11011 -j ACCEPT
-A FORWARD -d 192.168.1.16/32 ! -i weave -o weave -p tcp -m tcp --dport 11009 -j ACCEPT
-A FORWARD -d 192.168.1.16/32 ! -i weave -o weave -p tcp -m tcp --dport 11003 -j ACCEPT
````

Is your Docker daemon configured to use the weave bridge ?

**Comment by bmurphy1976** [comment]
I configured weave and docker following the instructions in this article: http://sttts.github.io/docker/weave/mesos/2015/01/22/weave.html

```
root@appcluster01-us-east-1b-host01:~# cat /etc/network/interfaces.d/weave.cfg
auto weave
iface weave inet manual
        pre-up /usr/local/sbin/weave create-bridge
        post-up /usr/local/sbin/weave expose 192.168.1.254/16
        pre-down /usr/local/sbin/weave hide 192.168.1.254/16 && ifconfig weave down
        post-down brctl delbr weave

root@appcluster01-us-east-1b-host01:~# cat /etc/default/docker
DOCKER_OPTS="-r=false -g /mnt/docker -H tcp://0.0.0.0:4243 -H unix:///var/run/docker.sock -s aufs --bridge=weave --fixed-cidr=192.168.1.0/25"
```

**Comment by bboreham** [comment]
OK, that would have been useful to know.

**Comment by bmurphy1976** [comment]
Sorry, I have a lot balls in the air at the moment.  To my knowledge that is the only special about our deployments to these servers.

**Comment by bboreham** [comment]
I'm wondering about this command: `weave expose 192.168.1.254/16`, which you run from `weave.cfg`.  This will have the effect of routing all traffic for the 192.168 network onto the weave bridge.

Then, you seem to have other peers connecting from addresses like 192.168.4.254 and 192.168.2.254, which are in that network.

Have I got that right?  The 'outside' IP addresses where Weave peers connect, and the 'inside' addresses that you want to use on the Weave network, must be disjoint.

**Comment by bmurphy1976** [comment]
Here is what I did in our cluster.

SERVER | DOCKER | BRIDGE
---|---|---
reserved | 192.168.0.0/25 | n/a
A | 192.168.1.0/25 | 192.168.1.254
B | 192.168.2.0/25 | 192.168.2.254
C | 192.168.3.0/25 | 192.168.3.254


The /25 networks were chosen so that the ip addresses docker allocated would not conflict with the ip address assigned to the bridge.

I did this so that I could deterministically manage ip addresses without having to introduce a centralized ip address coordination service (ala dhcp or etcd).

If I understand what you are saying, it might be better for me to do the following:

SERVER | DOCKER | BRIDGE
---|---|---
A | 192.168.1.x/24 | 192.168.0.1
B | 192.168.2.x/24 | 192.168.0.2
C | 192.168.3.x/24 | 192.168.0.3

Or maybe I misunderstand what you mean by disjoint and this isn't disjoint enough.

**Comment by bboreham** [comment]
Two things: 

- you've got 192.168.1.254/16 on the `weave expose`.  This /16 envelops all the /25 networks.  Won't work.
- you should `weave connect` using the real IP addresses of the machines where Weave is running.

**Comment by bmurphy1976** [comment]
I pulled the /16 from Stefan's article (linked above) so it sounds like that was bad advice and I have more to understand here. 

As for weave connect, I'm using the following `"weave launch -password PASSWORD [cname to known server]` where cname resolves to either private or public ip address depending on if the server is hosted within the same Amazon account.

**Comment by bmurphy1976** [comment]
I'm reviewing the article, I either misunderstood something or confused it with something else I was reading at the time.  I think I see what you are saying now.  I'm going to review all of our setting from top to bottom and follow up with what I find.

**Comment by bboreham** [comment]
The problem I'm talking about is that Weave thinks it should connect to other peers at addresses like 192.168.2.254; since this is inside your `weave expose` range the traffic will get routed round in a loop causing your symptoms of excessive CPU and network usage.

I had supposed you were supplying that address via `weave connect` or `weave launch`, but your comment about cname suggests not.  It's possible this is a side-effect of something else; can I get the first 50 lines or so of some of the weave logfiles so I can see how they get hold of these addresses?

**Comment by bmurphy1976** [comment]
```
weave 2015/02/27 16:54:41.147071 Command line options: map[name:7a:21:54:68:1a:41 wait:20 iface:ethwe]
weave 2015/02/27 16:54:41.147169 Command line peers: [appcluster02.CENSORED.com]
weave 2015/02/27 16:54:42.166419 Communication between peers is encrypted.
weave 2015/02/27 16:54:42.167253 Our name is 7a:21:54:68:1a:41
weave 2015/02/27 16:54:42.218374 Sniffing traffic on &{112343 65535 ethwe 4e:82:21:81:08:94 up|broadcast|multicast}
weave 2015/02/27 16:54:42.218434 Discovered our MAC 4e:82:21:81:08:94
weave 2015/02/27 16:54:42.225928 ->[10.9.168.20:6783] attempting connection
weave 2015/02/27 16:54:42.228421 ->[10.9.168.20:6783] completed handshake with 7a:87:ef:4c:d7:5e
weave 2015/02/27 16:54:42.229074 ->[7a:87:ef:4c:d7:5e]: connection added
weave 2015/02/27 16:54:42.240050 ->[192.168.4.254:55303] attempting connection
weave 2015/02/27 16:54:42.240254 ->[192.168.2.254:33902] attempting connection
weave 2015/02/27 16:54:42.240283 ->[10.179.163.107:6783] attempting connection
weave 2015/02/27 16:54:42.240626 ->[192.168.2.254:6783] attempting connection
weave 2015/02/27 16:54:42.240791 ->[192.168.4.254:6783] attempting connection
weave 2015/02/27 16:54:42.240868 Discovered local MAC 02:42:c0:a8:01:1d
weave 2015/02/27 16:54:42.240890 ->[192.168.4.254:37168] attempting connection
weave 2015/02/27 16:54:42.242278 ->[10.179.163.107:6783] completed handshake with 7a:8c:a1:e4:43:13
weave 2015/02/27 16:54:42.242572 ->[7a:8c:a1:e4:43:13]: connection added
weave 2015/02/27 16:54:42.247263 ->[7a:8c:a1:e4:43:13]: connection fully established
weave 2015/02/27 16:54:42.248094 EMSGSIZE on send, expecting PMTU update (IP packet was 60082 bytes, payload was 60074 bytes)
weave 2015/02/27 16:54:42.248120 ->[7a:8c:a1:e4:43:13]: Effective PMTU set to 8921
weave 2015/02/27 16:54:42.249826 ->[7a:8c:a1:e4:43:13]: Effective PMTU verified at 8921
weave 2015/02/27 16:54:42.361444 Discovered local MAC 7a:ac:57:fd:13:11
weave 2015/02/27 16:54:42.729650 ->[7a:87:ef:4c:d7:5e]: connection fully established
weave 2015/02/27 16:54:42.730106 EMSGSIZE on send, expecting PMTU update (IP packet was 60082 bytes, payload was 60074 bytes)
weave 2015/02/27 16:54:42.730134 ->[7a:87:ef:4c:d7:5e]: Effective PMTU set to 8921
weave 2015/02/27 16:54:42.734517 ->[7a:87:ef:4c:d7:5e]: Effective PMTU verified at 8921
weave 2015/02/27 16:54:43.238297 Discovered remote MAC 7a:8c:a1:e4:43:13 at 7a:8c:a1:e4:43:13
weave 2015/02/27 16:54:43.239231 ->[192.168.2.254:33902] error during connection attempt: dial tcp4 192.168.2.254:33902: connection refused
weave 2015/02/27 16:54:43.239296 Discovered remote MAC 7a:87:ef:4c:d7:5e at 7a:87:ef:4c:d7:5e
weave 2015/02/27 16:54:43.241462 ->[192.168.4.254:55303] error during connection attempt: dial tcp4 192.168.4.254:55303: connection refused
weave 2015/02/27 16:54:43.241503 ->[192.168.4.254:37168] error during connection attempt: dial tcp4 192.168.4.254:37168: connection refused
weave 2015/02/27 16:54:43.243027 ->[192.168.4.254:6783] connection shutting down due to error during handshake: Already have connection to 7a:87:ef:4c:d7:5e at 10.9.168.20:6783
weave 2015/02/27 16:54:43.243376 ->[192.168.2.254:6783] connection shutting down due to error during handshake: Already have connection to 7a:8c:a1:e4:43:13 at 10.179.163.107:6783
weave 2015/02/27 16:54:44.124888 ->[192.168.2.254:6783] attempting connection
weave 2015/02/27 16:54:44.128376 ->[192.168.2.254:6783] connection shutting down due to error during handshake: Already have connection to 7a:8c:a1:e4:43:13 at 10.179.163.107:6783
weave 2015/02/27 16:54:45.282446 ->[192.168.2.254:6783] attempting connection
weave 2015/02/27 16:54:45.287740 ->[192.168.2.254:6783] connection shutting down due to error during handshake: Already have connection to 7a:8c:a1:e4:43:13 at 10.179.163.107:6783
weave 2015/02/27 16:54:45.491320 ->[192.168.4.254:55303] attempting connection
weave 2015/02/27 16:54:45.492973 ->[192.168.4.254:55303] error during connection attempt: dial tcp4 192.168.4.254:55303: connection refused
weave 2015/02/27 16:54:46.997767 ->[192.168.2.254:6783] attempting connection
weave 2015/02/27 16:54:47.001073 ->[192.168.2.254:6783] connection shutting down due to error during handshake: Already have connection to 7a:8c:a1:e4:43:13 at 10.179.163.107:6783
weave 2015/02/27 16:54:47.834777 ->[192.168.4.254:55303] attempting connection
weave 2015/02/27 16:54:47.835958 ->[192.168.4.254:55303] error during connection attempt: dial tcp4 192.168.4.254:55303: connection refused
weave 2015/02/27 16:54:48.160116 ->[192.168.4.254:6783] attempting connection
weave 2015/02/27 16:54:48.164526 ->[192.168.4.254:6783] connection shutting down due to error during handshake: Already have connection to 7a:87:ef:4c:d7:5e at 10.9.168.20:6783
weave 2015/02/27 16:54:49.530927 ->[192.168.2.254:33902] attempting connection
weave 2015/02/27 16:54:49.532112 ->[192.168.2.254:33902] error during connection attempt: dial tcp4 192.168.2.254:33902: connection refused
weave 2015/02/27 16:54:49.867231 ->[192.168.2.254:6783] attempting connection
weave 2015/02/27 16:54:49.870291 ->[192.168.2.254:6783] connection shutting down due to error during handshake: Already have connection to 7a:8c:a1:e4:43:13 at 10.179.163.107:6783
weave 2015/02/27 16:54:50.447778 ->[192.168.4.254:55303] attempting connection
weave 2015/02/27 16:54:50.449157 ->[192.168.4.254:55303] error during connection attempt: dial tcp4 192.168.4.254:55303: connection refused
weave 2015/02/27 16:54:53.851543 ->[192.168.4.254:55303] attempting connection
weave 2015/02/27 16:54:53.852811 ->[192.168.4.254:55303] error during connection attempt: dial tcp4 192.168.4.254:55303: connection refused
weave 2015/02/27 16:54:54.802326 ->[192.168.4.254:6783] attempting connection
weave 2015/02/27 16:54:54.805658 ->[192.168.4.254:6783] connection shutting down due to error during handshake: Already have connection to 7a:87:ef:4c:d7:5e at 10.9.168.20:6783
weave 2015/02/27 16:54:55.455821 ->[192.168.2.254:6783] attempting connection
weave 2015/02/27 16:54:55.459012 ->[192.168.2.254:6783] connection shutting down due to error during handshake: Already have connection to 7a:8c:a1:e4:43:13 at 10.179.163.107:6783
weave 2015/02/27 16:54:57.553465 ->[192.168.4.254:55303] attempting connection
weave 2015/02/27 16:54:57.554509 ->[192.168.4.254:55303] error during connection attempt: dial tcp4 192.168.4.254:55303: connection refused
weave 2015/02/27 16:55:01.465502 ->[192.168.4.254:6783] attempting connection
weave 2015/02/27 16:55:01.473866 ->[192.168.4.254:6783] connection shutting down due to error during handshake: Already have connection to 7a:87:ef:4c:d7:5e at 10.9.168.20:6783
weave 2015/02/27 16:55:01.670146 ->[192.168.2.254:33902] attempting connection
weave 2015/02/27 16:55:01.672131 ->[192.168.2.254:33902] error during connection attempt: dial tcp4 192.168.2.254:33902: connection refused
weave 2015/02/27 16:55:04.241713 ->[192.168.4.254:55303] attempting connection
weave 2015/02/27 16:55:04.249189 ->[192.168.4.254:55303] error during connection attempt: dial tcp4 192.168.4.254:55303: connection refused
weave 2015/02/27 16:55:05.037337 ->[192.168.2.254:6783] attempting connection
weave 2015/02/27 16:55:05.041465 ->[192.168.2.254:6783] connection shutting down due to error during handshake: Already have connection to 7a:8c:a1:e4:43:13 at 10.179.163.107:6783
weave 2015/02/27 16:55:05.963053 Discovered remote MAC 02:42:c0:a8:04:44 at 7a:87:ef:4c:d7:5e
weave 2015/02/27 16:55:06.101378 Discovered remote MAC 02:42:c0:a8:04:43 at 7a:87:ef:4c:d7:5e
weave 2015/02/27 16:55:06.464400 Discovered remote MAC 02:42:c0:a8:04:45 at 7a:87:ef:4c:d7:5e
weave 2015/02/27 16:55:06.585662 Discovered remote MAC 02:42:c0:a8:04:47 at 7a:87:ef:4c:d7:5e
weave 2015/02/27 16:55:07.235022 Discovered remote MAC 02:42:c0:a8:04:46 at 7a:87:ef:4c:d7:5e
weave 2015/02/27 16:55:07.371076 Discovered remote MAC 02:42:c0:a8:04:48 at 7a:87:ef:4c:d7:5e
weave 2015/02/27 16:55:12.918750 ->[192.168.4.254:6783] attempting connection
weave 2015/02/27 16:55:12.923749 ->[192.168.4.254:6783] connection shutting down due to error during handshake: Already have connection to 7a:87:ef:4c:d7:5e at 10.9.168.20:6783
weave 2015/02/27 16:55:13.820416 ->[192.168.4.254:55303] attempting connection
weave 2015/02/27 16:55:13.821669 ->[192.168.4.254:55303] error during connection attempt: dial tcp4 192.168.4.254:55303: connection refused
weave 2015/02/27 16:55:15.880568 ->[192.168.2.254:33902] attempting connection
weave 2015/02/27 16:55:15.881460 ->[192.168.2.254:33902] error during connection attempt: dial tcp4 192.168.2.254:33902: connection refused
```

**Comment by bboreham** [comment]
OK, the 192.168.2.254 and 192.168.4.254 addresses are picked up as the 'remote' end of existing TCP connections between peers.  This is, I think, a consequence of the `weave expose` which sets up an `iptables MASQUERADE` rule so packets coming in to the network appear to come from a different address. 

Ping @sttts: can I ask what is the reason for doing this `weave expose`?  Your article suggests it is to assign an IP address to the bridge.

**Comment by bmurphy1976** [comment]
I've done some more testing on another simpler cluster that I created from scratch so it has a better chance of not being corrupted by previous configuration errors.

If the weave interface does not have an ip address assigned, Docker refuses to start with this error message: `Interface weave has no IP addresses`

For anybody else who may be following along and trying to do the same thing in the future, I found another problem.  Configuring the weave interface appears to be a little bit racey.  I had at least one instance where I rebooted the machine and the weave interface appears to have been created and docker started before the ip address was assigned to the interface.  I added `sleep 2s` to `weave.cfg`.  I don't know if that helped or not, but I haven't seen this problem since adding that.

weave.cfg:

```
auto weave
iface weave inet manual
        pre-up /usr/local/sbin/weave create-bridge
        post-up /usr/local/sbin/weave expose 192.168.0.1/16 && sleep 2s
        pre-down /usr/local/sbin/weave hide 192.168.0.1/16 && ifconfig weave down
        post-down brctl delbr weave
```

At the moment, I have a new cluster using the 192.168.0.1 gateway 192.168.1.0/8 network setup I proposed earlier.  I have not throw any kind of real load at it, but for the moment it appears to be behaving.  At the very least the weave output logs are significantly quieter than my other cluster.

`weave status` still shows a mixture of LAN (10.0.0.0/8) ip address and weave (192.168.0.0/16) ip addresses:

```
weave router 0.9.0
Encryption off
Our name is 7a:5b:f5:54:a8:19
Sniffing traffic on &{23 65535 ethwe 06:50:1f:9b:84:4a up|broadcast|multicast}
MACs:
02:42:c0:a8:03:01 -> 7a:d5:87:cd:79:f5 (2015-02-27 22:04:38.928646919 +0000 UTC)
02:42:c0:a8:01:01 -> 7a:5b:f5:54:a8:19 (2015-02-27 22:04:39.098451247 +0000 UTC)
7a:5b:f5:54:a8:19 -> 7a:5b:f5:54:a8:19 (2015-02-27 22:04:39.186378491 +0000 UTC)
92:8d:39:55:86:34 -> 7a:5b:f5:54:a8:19 (2015-02-27 22:04:39.266277973 +0000 UTC)
02:42:c0:a8:01:02 -> 7a:5b:f5:54:a8:19 (2015-02-27 22:04:43.723063696 +0000 UTC)
06:50:1f:9b:84:4a -> 7a:5b:f5:54:a8:19 (2015-02-27 22:04:38.923209653 +0000 UTC)
Peers:
Peer 7a:5b:f5:54:a8:19 (v4) (UID 9099649663092232142)
   -> 7a:78:20:61:58:69 [10.31.74.90:6783]
   -> 7a:d5:87:cd:79:f5 [10.101.178.164:6783]
Peer 7a:78:20:61:58:69 (v7) (UID 5317241633549192172)
   -> 7a:5b:f5:54:a8:19 [192.168.0.2:59970]
   -> 7a:d5:87:cd:79:f5 [10.101.178.164:6783]
Peer 7a:d5:87:cd:79:f5 (v7) (UID 3661073385738776459)
   -> 7a:5b:f5:54:a8:19 [192.168.0.3:58458]
   -> 7a:78:20:61:58:69 [192.168.0.3:43597]
Routes:
unicast:
7a:5b:f5:54:a8:19 -> 00:00:00:00:00:00
7a:78:20:61:58:69 -> 7a:78:20:61:58:69
7a:d5:87:cd:79:f5 -> 7a:d5:87:cd:79:f5
broadcast:
7a:5b:f5:54:a8:19 -> [7a:78:20:61:58:69 7a:d5:87:cd:79:f5]
7a:78:20:61:58:69 -> []
7a:d5:87:cd:79:f5 -> []
Reconnects:
```

**Comment by sttts** [comment]
@bboreham the reason is to assign an IP for hose such that port forwardings ```-p 32080:80``` keep working. In my case, I am running Mesos with Marathon. Neither knows about the internal ```native``` ports yet, so things like healthchecks go through the exposed IP via the iptables rules by docker.

In my proof of concept implementation of the article I actually configure the exposed interface of the host as 10.0.0.0/8, covering all sub-networks 10.x.0.0/16 (x!=0), i.e. like @bmurphy1976 does. I didn't see any masquerading of packets at that time. I can check my installation. I still have it as Vagrant machine I think.

**Comment by sttts** [comment]
Checked my setup, masquerading is setup the same way as in the `iptables-save` example above. I also see @bmurphy1976's mixed peer IPs in `weave status`.

@bboreham can you elaborate more on which packets are routed in a loop and why? I don't see this here. `tcpdump` between the machines only shows udp packets using the private LAN ips. `tcpdump` on the weave interface only shows the application traffic with the expected container IPs. So nothing unusual here.

**Comment by bboreham** [comment]
I replicated your set-up to confirm what is happening.

As you have seen, Weave has amongst its connections various IP addresses, some of which are 'real' (e.g. 10.9.168.20) and some of which are masqueraded (e.g. 192.168.4.254):

````
Peer 7a:8f:17:40:9e:ce (v641) (UID 14711164464184655389)
   -> 7a:87:ef:4c:d7:5e [10.9.168.20:6783]
   -> 7a:21:54:68:1a:41 [10.99.185.203:6783]
   -> 7a:8c:a1:e4:43:13 [10.179.163.107:6783]
Peer 7a:87:ef:4c:d7:5e (v337) (UID 4530646544833339324)
   -> 7a:02:0f:ac:19:f4 [192.168.4.254:41517]
   -> 7a:8f:17:40:9e:ce [192.168.4.254:55303]
````

At https://gist.github.com/bmurphy1976/e93080a4a04a368109fe we see Weave connecting with another peer at a masqueraded address:

````
weave 2015/02/25 01:31:49.327169 ->[192.168.1.254:6783] attempting connection
weave 2015/02/25 01:31:49.750453 ->[192.168.1.254:6783] completed handshake with 7a:21:54:68:1a:41
weave 2015/02/25 01:31:49.767076 ->[7a:21:54:68:1a:41]: connection fully established
````

This is standard Weave behaviour: it tries to connect to any IP address it sees connected elsewhere, and it tries both on the port seen there and on its standard port (6783).

However, the only way it can make an outgoing connection to 192.168.1.254 is _across the Weave network_.  So now we have a loop: every time we try to send data to that peer it needs to be encapsulated and sent across the Weave network, which in turn will get encapsulated, and so on.

In order to get into this state, the peer has to have an existing connection to the Weave network, and it needs to succeed in connecting via the masqueraded address before it connects via the 'real' address.  I needed to set up four peers before I could force this to happen, and it only happens about one in every three attempts.

**Comment by bboreham** [comment]
Within my replica set-up, I tried just giving the weave bridge an IP address without the masquerade rules, and that let me bring up a stable weave network. I don't know if this is sufficient to do what you need with Mesos/Marathon.

The command I used was:

    sudo ip addr add dev weave <CIDR>

**Comment by sttts** [comment]
Thanks for the detailed analysis. 

I configured weave now as suggested: without `expose`, but by assigning only the IP. The setup still works fine. It's not surprising because for internet routing and access to the private LAN ips of the hosts, it is enough to have the remaining masquerading rule:
```
-A POSTROUTING -s 10.42.0.0/16 ! -o weave -j MASQUERADE
```

**Comment by sttts** [comment]
@bmurphy1976 Updated my blog post: http://sttts.github.io/docker/weave/mesos/2015/01/22/weave.html#expose-update-remark

**Comment by bmurphy1976** [comment]
@sttts awesome.  I'm going to redo our test cluster as well and see how that impacts things.

**Comment by sttts** [comment]
I have tested it in a small Vagrant setup. If you find problems in a bigger setup, of course I am interested :-)

**Comment by bmurphy1976** [comment]
I've managed to test a small cluster and everything looked good.  

I'm slowly updating our existing cluster.  I've managed to replace a few nodes in the cluster and those nodes are behaving better.  Tomorrow I plan to replace the last two most troublesome nodes (including the one that had major CPU usage issues).

I should have a good idea in the next day or two how much better things are running in a live and realistic environment (8 servers, 3 high utilization, 4 medium/low utilization).

**Comment by bboreham** [comment]
Ok, I'm going to close these two issues. Feel free to reopen if you get further info.

**Comment by bmurphy1976** [comment]
Our cluster has been fully upgraded and is running at load.   No issues so far, things look great!

**Comment by sttts** [comment]
Great new! Thanks for pointing out the issue and the support to fix it.
